{
  "format": "ovs-node-runtime-states",
  "version": "0.1",
  "built": "2026-07-15",
  "source": [
    "app/data/nodes/node-load-plan.json",
    "app/data/nodes/ask-presentation.json",
    "app/data/nodes/node-route-guardrails.json",
    "app/data/nodes/manifest.json"
  ],
  "purpose": "Generated runtime state and failure-mode fixtures for app-owned node and Ask integration.",
  "appLaneNote": "State contract only; app-owned code chooses visual treatment, exact copy, interaction timing, and telemetry policy.",
  "caseFields": [
    "id",
    "family",
    "stage",
    "trigger",
    "requiredBehavior",
    "mustNot",
    "sourceFiles"
  ],
  "qaContract": {
    "purpose": "App-owned runtime QA contract for generated node and Ask loading states.",
    "status": "pending-app-integration",
    "h4DrainableFromDataAlone": false,
    "drainRule": "H4 runtime-state QA drains only after app-owned behavior is checked against each referenced case requiredBehavior and mustNot clause.",
    "modes": [
      {
        "id": "startup-smoke",
        "owner": "app/design",
        "caseIds": [
          "metadata-loading",
          "metadata-unavailable",
          "hash-mismatch-retry",
          "hash-mismatch-unavailable",
          "ask-core-loading",
          "ask-core-unavailable",
          "ask-no-results",
          "offline-core-available"
        ],
        "sourceFiles": [
          "manifest.json",
          "node-load-plan.json",
          "ask-core.json",
          "ask-presentation.json"
        ],
        "passWhen": [
          "The base app remains usable while metadata and ask-core.json load.",
          "Startup Ask never requires ask-index-*.json for core category, brand, company, guide, line, tag, or errand results.",
          "Empty and unavailable states route to the generated recovery hashes."
        ],
        "mustNot": [
          "Do not block category browsing on generated-node startup work.",
          "Do not claim product or barcode coverage before ask-index-*.json is loaded and valid."
        ]
      },
      {
        "id": "route-page-smoke",
        "owner": "app/design",
        "caseIds": [
          "page-node-loading",
          "page-node-unavailable",
          "unknown-target-route",
          "malformed-route",
          "canonical-route-rewrite"
        ],
        "sourceFiles": [
          "brands.json",
          "companies.json",
          "node-page-contracts.json",
          "node-route-guardrails.json"
        ],
        "passWhen": [
          "Known brand and company routes can wait for their lazy indexes without breaking unrelated routes.",
          "Unknown and malformed hashes recover without fabricating node pages.",
          "Canonical route rewrites preserve encoded generated ids."
        ],
        "mustNot": [
          "Do not render partial brand or company data as a complete page.",
          "Do not redirect an unknown generated route to a different real node."
        ]
      },
      {
        "id": "lazy-product-smoke",
        "owner": "app/design",
        "caseIds": [
          "lazy-product-loading",
          "lazy-product-unavailable"
        ],
        "sourceFiles": [
          "ask-index-0-2.json",
          "ask-index-3.json",
          "ask-index-4-5.json",
          "ask-index-6-9.json",
          "ask-index-a.json",
          "ask-index-b.json",
          "ask-index-c.json",
          "ask-index-d-e.json",
          "ask-index-f-g.json",
          "ask-index-h-j.json",
          "ask-index-k-l.json",
          "ask-index-m.json",
          "ask-index-n-o.json",
          "ask-index-p-q.json",
          "ask-index-r.json",
          "ask-index-s.json",
          "ask-index-t-v.json",
          "ask-index-w-z.json",
          "manifest.json",
          "node-load-plan.json"
        ],
        "passWhen": [
          "ask-index-*.json loads only after a product-name or barcode path asks for it.",
          "Core Ask results stay visible while the lazy product index loads.",
          "A lazy index failure disables only product and barcode lookup."
        ],
        "mustNot": [
          "Do not eagerly load ask-index-*.json at startup.",
          "Do not treat lazy product failure as failure of categories, guides, or node pages."
        ]
      },
      {
        "id": "copy-failure-review",
        "owner": "app/design",
        "caseIds": [
          "metadata-loading",
          "metadata-unavailable",
          "hash-mismatch-retry",
          "hash-mismatch-unavailable",
          "ask-core-loading",
          "ask-core-unavailable",
          "ask-no-results",
          "page-node-loading",
          "page-node-unavailable",
          "unknown-target-route",
          "malformed-route",
          "canonical-route-rewrite",
          "lazy-product-loading",
          "lazy-product-unavailable",
          "offline-core-available"
        ],
        "sourceFiles": [
          "node-runtime-states.json"
        ],
        "passWhen": [
          "Every visible loading, unavailable, empty, route, integrity, and offline state names the affected capability plainly.",
          "Recovery copy offers browse, search, reload, retry, or request paths already named by the fixture.",
          "No state implies the whole app failed when only one generated-node capability is unavailable."
        ],
        "mustNot": [
          "Do not add urgency, blame, or engagement copy to runtime failure states.",
          "Do not hide the app-owned copy decision behind generated placeholder prose."
        ]
      }
    ],
    "loadStageCoverage": {
      "bootstrap-metadata": {
        "loadHint": "eager-metadata",
        "runtime": true,
        "sourceFiles": [
          "manifest.json",
          "node-load-plan.json"
        ],
        "caseIds": [
          "metadata-loading",
          "metadata-unavailable",
          "hash-mismatch-retry",
          "hash-mismatch-unavailable",
          "malformed-route"
        ]
      },
      "defer-page-nodes": {
        "loadHint": "defer-page-nodes",
        "runtime": true,
        "sourceFiles": [
          "brands.json",
          "companies.json"
        ],
        "caseIds": [
          "page-node-loading",
          "page-node-unavailable",
          "unknown-target-route",
          "canonical-route-rewrite"
        ]
      },
      "lazy-product-ask": {
        "loadHint": "lazy-product-search",
        "runtime": true,
        "sourceFiles": [
          "ask-index-0-2.json",
          "ask-index-3.json",
          "ask-index-4-5.json",
          "ask-index-6-9.json",
          "ask-index-a.json",
          "ask-index-b.json",
          "ask-index-c.json",
          "ask-index-d-e.json",
          "ask-index-f-g.json",
          "ask-index-h-j.json",
          "ask-index-k-l.json",
          "ask-index-m.json",
          "ask-index-n-o.json",
          "ask-index-p-q.json",
          "ask-index-r.json",
          "ask-index-s.json",
          "ask-index-t-v.json",
          "ask-index-w-z.json"
        ],
        "caseIds": [
          "lazy-product-loading",
          "lazy-product-unavailable"
        ]
      },
      "startup-ask-core": {
        "loadHint": "eager-search",
        "runtime": true,
        "sourceFiles": [
          "ask-core.json"
        ],
        "caseIds": [
          "ask-core-loading",
          "ask-core-unavailable",
          "ask-no-results",
          "offline-core-available"
        ]
      }
    },
    "coverage": {
      "caseCount": 15,
      "modeCount": 4,
      "stagesCovered": 4,
      "allCasesCovered": true,
      "runtimeModeIds": [
        "startup-smoke",
        "route-page-smoke",
        "lazy-product-smoke"
      ],
      "manualReviewModeIds": [
        "copy-failure-review"
      ]
    }
  },
  "cases": [
    {
      "id": "metadata-loading",
      "family": "loading",
      "stage": "bootstrap-metadata",
      "trigger": "manifest.json and node-load-plan.json are being fetched or parsed.",
      "requiredBehavior": [
        "Keep the base app usable while generated node features initialize.",
        "Avoid claiming generated node or Ask coverage before metadata is known.",
        "Prepare cache keys from manifest sha256 values once metadata is available."
      ],
      "mustNot": [
        "Do not block category browsing on full generated node indexes.",
        "Do not start loading ask-index-*.json before the load plan is known."
      ],
      "appOwnedCopyIntent": "Use calm, honest copy that names what is unavailable without implying total app failure.",
      "sourceFiles": [
        "manifest.json",
        "node-load-plan.json"
      ]
    },
    {
      "id": "metadata-unavailable",
      "family": "unavailable",
      "stage": "bootstrap-metadata",
      "trigger": "Metadata fetch, JSON parse, or required field validation fails.",
      "requiredBehavior": [
        "Keep existing app search and browse paths available.",
        "Mark generated node features as unavailable for this session or until retry.",
        "Offer a neutral recovery path such as browse or reload."
      ],
      "mustNot": [
        "Do not fabricate generated node coverage.",
        "Do not continue into generated Ask integration without a usable manifest."
      ],
      "appOwnedCopyIntent": "Use calm, honest copy that names what is unavailable without implying total app failure.",
      "sourceFiles": [
        "manifest.json",
        "node-load-plan.json"
      ]
    },
    {
      "id": "hash-mismatch-retry",
      "family": "integrity",
      "stage": "bootstrap-metadata",
      "trigger": "A loaded generated node file does not match the sha256 value in manifest.json.",
      "requiredBehavior": [
        "Treat the cached copy as stale or corrupted.",
        "Refetch the mismatched file once using the manifest cache key shape.",
        "Keep already-valid stages usable while the retry happens."
      ],
      "mustNot": [